{
  "schema_version": "ctoa.conditions-shadow-scenario-pack.v1",
  "fixture_only": true,
  "operational_readiness_claimed": false,
  "evaluated_at_unix_ms": 1783800000000,
  "scenarios": [
    {"name": "positive_shadow_plan", "mutation": "none", "expected_status": "shadow_plan_ready", "expected_blockers": []},
    {"name": "profile_wrong_action", "mutation": "profile_wrong_action", "expected_status": "operational_acceptance_blocked", "expected_blockers": ["profile_action_mismatch"]},
    {"name": "profile_wrong_condition", "mutation": "profile_wrong_condition", "expected_status": "operational_acceptance_blocked", "expected_blockers": ["profile_condition_mismatch"]},
    {"name": "profile_wrong_spell", "mutation": "profile_wrong_spell", "expected_status": "operational_acceptance_blocked", "expected_blockers": ["profile_spell_mismatch"]},
    {"name": "profile_retry_nonzero", "mutation": "profile_retry_nonzero", "expected_status": "operational_acceptance_blocked", "expected_blockers": ["profile_retry_budget_nonzero"]},
    {"name": "profile_future_version", "mutation": "profile_future_version", "expected_status": "operational_acceptance_blocked", "expected_blockers": ["profile_schema_invalid"]},
    {"name": "profile_malformed", "mutation": "profile_malformed", "expected_status": "operational_acceptance_blocked", "expected_blockers": ["profile_malformed"]},
    {"name": "profile_duplicate_keys", "mutation": "profile_duplicate_keys", "expected_status": "operational_acceptance_blocked", "expected_blockers": ["profile_duplicate_keys"]},
    {"name": "profile_oversized", "mutation": "profile_oversized", "expected_status": "operational_acceptance_blocked", "expected_blockers": ["profile_oversize"]},
    {"name": "profile_symlinked", "mutation": "profile_symlinked", "expected_status": "operational_acceptance_blocked", "expected_blockers": ["profile_symlink_rejected"]},
    {"name": "profile_non_regular", "mutation": "profile_non_regular", "expected_status": "operational_acceptance_blocked", "expected_blockers": ["profile_not_regular"]},
    {"name": "profile_extra_field", "mutation": "profile_extra_field", "expected_status": "operational_acceptance_blocked", "expected_blockers": ["profile_schema_invalid"]},
    {"name": "observation_stale", "mutation": "observation_stale", "expected_status": "operational_acceptance_blocked", "expected_blockers": ["observation_stale"]},
    {"name": "observation_future", "mutation": "observation_future", "expected_status": "operational_acceptance_blocked", "expected_blockers": ["observation_future"]},
    {"name": "player_offline", "mutation": "player_offline", "expected_status": "operational_acceptance_blocked", "expected_blockers": ["player_offline"]},
    {"name": "player_online_unknown", "mutation": "player_online_unknown", "expected_status": "operational_acceptance_blocked", "expected_blockers": ["player_online_unknown"]},
    {"name": "player_dead", "mutation": "player_dead", "expected_status": "operational_acceptance_blocked", "expected_blockers": ["player_dead"]},
    {"name": "player_life_unknown", "mutation": "player_life_unknown", "expected_status": "operational_acceptance_blocked", "expected_blockers": ["player_life_unknown"]},
    {"name": "protection_zone_inside", "mutation": "protection_zone_inside", "expected_status": "operational_acceptance_blocked", "expected_blockers": ["protection_zone_inside"]},
    {"name": "protection_zone_unknown", "mutation": "protection_zone_unknown", "expected_status": "operational_acceptance_blocked", "expected_blockers": ["protection_zone_unknown"]},
    {"name": "condition_absent", "mutation": "condition_absent", "expected_status": "operational_acceptance_blocked", "expected_blockers": ["condition_absent"]},
    {"name": "condition_unknown", "mutation": "condition_unknown", "expected_status": "operational_acceptance_blocked", "expected_blockers": ["condition_unknown"]},
    {"name": "condition_wrong", "mutation": "condition_wrong", "expected_status": "operational_acceptance_blocked", "expected_blockers": ["condition_mismatch"]},
    {"name": "cooldown_active", "mutation": "cooldown_active", "expected_status": "operational_acceptance_blocked", "expected_blockers": ["cooldown_active"]},
    {"name": "cooldown_unknown", "mutation": "cooldown_unknown", "expected_status": "operational_acceptance_blocked", "expected_blockers": ["cooldown_unknown"]},
    {"name": "observation_extra_field", "mutation": "observation_extra_field", "expected_status": "operational_acceptance_blocked", "expected_blockers": ["observation_schema_invalid"]},
    {"name": "observation_unsafe_contract", "mutation": "observation_unsafe_contract", "expected_status": "operational_acceptance_blocked", "expected_blockers": ["observation_unsafe_contract"]},
    {"name": "p8_missing", "mutation": "p8_missing", "expected_status": "operational_acceptance_blocked", "expected_blockers": ["p8_missing"]},
    {"name": "p8_blocked", "mutation": "p8_blocked", "expected_status": "operational_acceptance_blocked", "expected_blockers": ["p8_operational_acceptance_blocked"]},
    {"name": "p8_stale", "mutation": "p8_stale", "expected_status": "operational_acceptance_blocked", "expected_blockers": ["p8_stale"]},
    {"name": "p8_future", "mutation": "p8_future", "expected_status": "operational_acceptance_blocked", "expected_blockers": ["p8_future"]},
    {"name": "p8_unsafe_contract", "mutation": "p8_unsafe_contract", "expected_status": "operational_acceptance_blocked", "expected_blockers": ["p8_operational_acceptance_blocked", "p8_unsafe_contract"]},
    {"name": "p8_extra_field", "mutation": "p8_extra_field", "expected_status": "operational_acceptance_blocked", "expected_blockers": ["p8_schema_invalid"]},
    {"name": "recovery_missing", "mutation": "recovery_missing", "expected_status": "operational_acceptance_blocked", "expected_blockers": ["recovery_missing"]},
    {"name": "recovery_malformed", "mutation": "recovery_malformed", "expected_status": "operational_acceptance_blocked", "expected_blockers": ["recovery_malformed"]},
    {"name": "recovery_status_blocked", "mutation": "recovery_status_blocked", "expected_status": "operational_acceptance_blocked", "expected_blockers": ["recovery_status_blocked"]},
    {"name": "recovery_future", "mutation": "recovery_future", "expected_status": "operational_acceptance_blocked", "expected_blockers": ["recovery_future"]},
    {"name": "recovery_stale", "mutation": "recovery_stale", "expected_status": "operational_acceptance_blocked", "expected_blockers": ["recovery_stale"]},
    {"name": "recovery_wrong_action", "mutation": "recovery_wrong_action", "expected_status": "operational_acceptance_blocked", "expected_blockers": ["recovery_action_mismatch"]},
    {"name": "recovery_wrong_condition", "mutation": "recovery_wrong_condition", "expected_status": "operational_acceptance_blocked", "expected_blockers": ["recovery_condition_mismatch"]},
    {"name": "recovery_wrong_spell", "mutation": "recovery_wrong_spell", "expected_status": "operational_acceptance_blocked", "expected_blockers": ["recovery_spell_mismatch"]},
    {"name": "recovery_hash_mismatch", "mutation": "recovery_hash_mismatch", "expected_status": "operational_acceptance_blocked", "expected_blockers": ["recovery_observation_hash_mismatch"]},
    {"name": "recovery_extra_field", "mutation": "recovery_extra_field", "expected_status": "operational_acceptance_blocked", "expected_blockers": ["recovery_schema_invalid"]},
    {"name": "recovery_unsafe_contract", "mutation": "recovery_unsafe_contract", "expected_status": "operational_acceptance_blocked", "expected_blockers": ["recovery_unsafe_contract"]}
  ]
}
